{
  "$schema": "./resources.schema.json",
  "schema_version": 2,
  "last_updated": "2026-10-30",
  "website_url": "https://nodeology.ai/resources/pxrd2xtal",
  "inference_order": [
    "uni3dar",
    "pxrdnet",
    "decifer",
    "crystalyze",
    "diffractgpt",
    "crystallm-pi",
    "xrdsol",
    "ab-pxrd-solver"
  ],
  "shared_urls": [
    "https://academic.oup.com/nsr/article/12/12/nwaf421/8268901",
    "https://arxiv.org/abs/2603.00965",
    "https://arxiv.org/abs/2603.23367",
    "https://arxiv.org/abs/2609.00070",
    "https://arxiv.org/abs/2609.06908",
    "https://arxiv.org/abs/2610.07862",
    "https://arxiv.org/abs/2610.16480",
    "https://github.com/Bin-Cao/XQueryer",
    "https://github.com/ai4mat-zhu/XRDSol",
    "https://github.com/dongyeop3813/PXRD-Bench",
    "https://github.com/liqi-529/RealPXRD-Solver",
    "https://huggingface.co/datasets/caobin/opxrd_hkust_expdata",
    "https://huggingface.co/linked-liszt/OpenAlphaDiffract"
  ],
  "resources": [
    {
      "id": "crystalnet",
      "name": "CrystalNet",
      "category": "core_solver",
      "scope_relation": "direct_pxrd",
      "verified_at": "2026-05-09",
      "year": "2024",
      "inputs_target": "PXRD + composition information → electron density / structure",
      "method": "Coordinate-based VAE for electron density",
      "reported_performance": "Up to 93.4% SSIM on cubic test cases; 74.1% average SSIM on trigonal cases",
      "paper_links": [
        {
          "label": "npj Computational Materials",
          "url": "https://www.nature.com/articles/s41524-024-01401-8",
          "role": "paper"
        }
      ],
      "artifact_links": [
        {
          "label": "gabeguo/deep-crystallography-public",
          "url": "https://github.com/gabeguo/deep-crystallography-public",
          "role": "code"
        }
      ]
    },
    {
      "id": "crystalyze",
      "name": "Crystalyze",
      "category": "core_solver",
      "scope_relation": "direct_pxrd",
      "verified_at": "2026-05-09",
      "year": "2024",
      "inputs_target": "PXRD → CIF / crystal structure",
      "method": "End-to-end PXRD-to-CIF pipeline",
      "reported_performance": "42% experimental match; 67% simulated match",
      "paper_links": [
        {
          "label": "JACS",
          "url": "https://pubs.acs.org/doi/abs/10.1021/jacs.4c10244",
          "role": "paper"
        }
      ],
      "artifact_links": [
        {
          "label": "ML-PXRD/Crystalyze",
          "url": "https://github.com/ML-PXRD/Crystalyze",
          "role": "code"
        }
      ],
      "inference": {
        "local": [
          {
            "label": "run.py",
            "url": "inference/crystalyze/run.py",
            "role": "inference",
            "code_label": true
          }
        ],
        "cloud": [],
        "support": [
          {
            "label": "setup.sh",
            "url": "inference/crystalyze/setup.sh",
            "role": "inference",
            "code_label": true
          },
          {
            "label": "manifest.yaml",
            "url": "inference/crystalyze/manifest.yaml",
            "role": "inference",
            "code_label": true
          },
          {
            "label": "README.md",
            "url": "inference/crystalyze/README.md",
            "role": "inference",
            "code_label": true
          },
          {
            "label": "reproduce_examples.py",
            "url": "inference/crystalyze/reproduce_examples.py",
            "role": "inference",
            "code_label": true
          }
        ],
        "environment": [
          {
            "label": "environment.yml",
            "url": "inference/crystalyze/environment.yml",
            "role": "inference",
            "code_label": true
          }
        ]
      }
    },
    {
      "id": "xtalnet",
      "name": "XtalNet",
      "category": "core_solver",
      "scope_relation": "direct_pxrd",
      "verified_at": "2026-07-27",
      "year": "2024/2025",
      "inputs_target": "PXRD + composition / MOF setting → crystal structure candidates",
      "method": "Contrastive PXRD-crystal pretraining + conditional equivariant diffusion",
      "reported_performance": "Top-10 match rate: 90.2% on hMOF-100 and 79% on hMOF-400",
      "paper_links": [
        {
          "label": "Advanced Science",
          "url": "https://advanced.onlinelibrary.wiley.com/doi/full/10.1002/advs.202410722",
          "role": "paper"
        }
      ],
      "artifact_links": [
        {
          "label": "dptech-corp/XtalNet",
          "url": "https://github.com/dptech-corp/XtalNet",
          "role": "code"
        },
        {
          "label": "Zenodo: hMOF-100/400 + code/data",
          "url": "https://zenodo.org/records/13629658",
          "role": "data"
        }
      ]
    },
    {
      "id": "pxrdnet",
      "name": "PXRDnet",
      "category": "core_solver",
      "scope_relation": "direct_pxrd",
      "verified_at": "2026-05-09",
      "year": "2025",
      "inputs_target": "Formula + finite-size-broadened PXRD → atomic structure candidates",
      "method": "SE(3)-equivariant score-based diffusion; post-Rietveld verification",
      "reported_performance": "Verifiable candidates for simulated nanocrystals in ~4/5 cases; average post-Rietveld R factor ~7%; median RMSD ≤0.11 Å in reported benchmarks",
      "paper_links": [
        {
          "label": "Nature Materials",
          "url": "https://www.nature.com/articles/s41563-025-02220-y",
          "role": "paper"
        }
      ],
      "artifact_links": [
        {
          "label": "gabeguo/cdvae_xrd",
          "url": "https://github.com/gabeguo/cdvae_xrd",
          "role": "code"
        }
      ],
      "inference": {
        "local": [
          {
            "label": "run.py",
            "url": "inference/pxrdnet/run.py",
            "role": "inference",
            "code_label": true
          }
        ],
        "cloud": [],
        "support": [
          {
            "label": "setup.sh",
            "url": "inference/pxrdnet/setup.sh",
            "role": "inference",
            "code_label": true
          },
          {
            "label": "manifest.yaml",
            "url": "inference/pxrdnet/manifest.yaml",
            "role": "inference",
            "code_label": true
          },
          {
            "label": "README.md",
            "url": "inference/pxrdnet/README.md",
            "role": "inference",
            "code_label": true
          }
        ],
        "environment": [
          {
            "label": "environment.yml",
            "url": "inference/pxrdnet/environment.yml",
            "role": "inference",
            "code_label": true
          }
        ]
      }
    },
    {
      "id": "pxrdgen",
      "name": "PXRDGen",
      "category": "core_solver",
      "scope_relation": "direct_pxrd",
      "verified_at": "2026-05-09",
      "year": "2025",
      "inputs_target": "PXRD + optional composition constraints → structure candidates",
      "method": "Pretrained XRD encoder + diffusion/flow generator + automatic Rietveld refinement",
      "reported_performance": "MP-20: 82% valid compounds from 1 sample; 96% within 20 samples",
      "paper_links": [
        {
          "label": "Nature Communications",
          "url": "https://www.nature.com/articles/s41467-025-62708-8",
          "role": "paper"
        }
      ],
      "artifact_links": [
        {
          "label": "CodeOcean capsule",
          "url": "https://codeocean.com/capsule/7727770/tree/v1",
          "role": "code"
        }
      ]
    },
    {
      "id": "decifer",
      "name": "deCIFer",
      "category": "core_solver",
      "scope_relation": "direct_pxrd",
      "verified_at": "2026-10-05",
      "year": "2025/2026",
      "inputs_target": "PXRD-conditioned generation → CIF tokens",
      "method": "Autoregressive Transformer / CIF language modeling",
      "reported_performance": "94% structure match in author-reported setting",
      "paper_links": [
        {
          "label": "TMLR / OpenReview",
          "url": "https://openreview.net/forum?id=LftFQ35l47",
          "role": "paper"
        },
        {
          "label": "Digital Discovery experimental evaluation",
          "url": "https://doi.org/10.1039/d6dd00088f",
          "role": "paper"
        }
      ],
      "artifact_links": [
        {
          "label": "FrederikLizakJohansen/deCIFer",
          "url": "https://github.com/FrederikLizakJohansen/deCIFer",
          "role": "code"
        }
      ],
      "artifact_note": "The 2026 experimental evaluation reports recovery of known Si and CeO2 structures, while lower-symmetry Fe2O3 and nanocrystalline CeO2 expose expected limits; this is a four-case diagnostic, not a broad experimental success rate",
      "inference": {
        "local": [
          {
            "label": "run.py",
            "url": "inference/decifer/run.py",
            "role": "inference",
            "code_label": true
          }
        ],
        "cloud": [],
        "support": [
          {
            "label": "setup.sh",
            "url": "inference/decifer/setup.sh",
            "role": "inference",
            "code_label": true
          },
          {
            "label": "manifest.yaml",
            "url": "inference/decifer/manifest.yaml",
            "role": "inference",
            "code_label": true
          },
          {
            "label": "README.md",
            "url": "inference/decifer/README.md",
            "role": "inference",
            "code_label": true
          }
        ],
        "environment": [
          {
            "label": "environment.yml",
            "url": "inference/decifer/environment.yml",
            "role": "inference",
            "code_label": true
          }
        ]
      }
    },
    {
      "id": "diffractgpt",
      "name": "DiffractGPT",
      "category": "core_solver",
      "scope_relation": "direct_pxrd",